{
  "schemaVersion": 1,
  "eventType": "RETRY",
  "deviceId": "esp32-bench",
  "commandId": "22222222-2222-4222-8222-222222222222",
  "sessionId": "22222222-2222-4222-8222-222222222222",
  "targetBootId": "11111111-1111-4111-8111-111111111111",
  "windowId": "22222222-2222-4222-8222-222222222222"
}
